"ID","Nome","Tipo","Status","Processo","Capacidade","Infraestrutura","Pendências","Plano Diretor","CAPEX","Latitude","Longitude"
"origem","Prefeitura Municipal de Andradas","Ponto de Partida","Institucional","-","-","-","Ponto de encontro e saída oficial para as vistorias técnicas.","-","-","-22.066532","-46.568461"
"ete-sao-cristovao","ETE Jardim São Cristóvão (Sede)","ETE Principal","Operacional (Com patologias)","Lodos ativados em regime de aeração prolongada.","Qméd: 46,71 L/s | Qmáx: 61,68 L/s (atende aprox. 8.525 habitantes).","Canal de entrada, gradeamento, caixa de areia/gordura, calha Parshall de 6"", 04 tanques de aeração equipados com 12 aeradores superficiais, 04 decantadores secundários e recirculação. Prédio de desidratação possui centrífuga e filtro prensa.","O sistema de desidratação (centrífuga) está subdimensionado. Apresenta patologias estruturais severas (trincas, infiltrações e armaduras expostas nos prédios), necessita de impermeabilização nos tanques, reforma dos leitos de secagem, modernização de painéis elétricos e não possui sistema de cloração implantado. A eficiência atual é comprometida pelo ponto de lançamento em trecho de baixa autodepuração.","Ampliação e adequação completa, incluindo instalação de bombas dosadoras para desinfecção, medição ultrassônica, requalificação estrutural e adequação às normas NR-10/NR-12.","R$ 5.087.068,00","-22.070079","-46.604791"
"ete-amelia","ETE Jardim Amélia","ETE a desativar","Inoperante (Em by-pass)","Projetada para lodos ativados com aeração prolongada.","Qméd: 6,22 m³/h | Qmáx: 10,70 m³/h.","Gradeamento, caixas de areia/gordura, tanque de aeração em concreto (246,4 m³), decantador secundário (20,70 m³) e 10 leitos de secagem.","Totalmente inoperante no momento (operando em by-pass). Estruturas sem impermeabilização específica, bombas paradas e ausência de cercamento de segurança, sofrendo com vandalismo.","Desativação permanente. Será substituída por uma Estação Elevatória de Esgoto Compacta (EEEC) para bombeamento ao novo interceptor.","-","-22.081381","-46.594044"
"ete-heloisa","ETE Jardim Heloísa","ETE a desativar","Operacional (Vulnerável)","Lodos ativados com aeração prolongada (tratamento aeróbio e decantação).","Qméd: 3,55 L/s | Qmáx: 6,15 L/s.","EEE associada com 02 bombas submersíveis Sulzer (Robusta) operando em 01+01 (vazão 32,2 m³/h, 10 mca). Gradeamento, reator anaeróbio em PRFV (177 m³), aeração mecanizada com equipamento de 4,6 CV, 04 decantadores secundários e caixa cloradora de 10.000 L.","Tanques PRFV com alta vulnerabilidade à radiação solar. Sistema de cloração rudimentar e elementos hidráulicos/civis inoperantes.","Desativação permanente e substituição por EEEC.","-","-22.096845","-46.579513"
"ete-portal-mantiqueira","ETE Portal da Mantiqueira","ETE a desativar","Operacional (Requer Revitalização)","Lodos ativados com aeração prolongada.","-","Canal de entrada (7,5 m), reator aerado com 02 aeradores mecânicos superficiais flutuantes de 10 CV cada, 10 leitos de secagem e tanque de contato com chicanas.","Sem dosagem de desinfetante implantada. Pequenos vazamentos no concreto, sistema hidráulico inoperante e ausência de muros/iluminação.","Demanda revitalização completa imediata, mas o plano final é desativação permanente e substituição por EEEC.","-","-22.069435","-46.585201"
"ete-santo-antonio","ETE Santo Antônio de Lisboa","ETE Completa","Operacional","Sistema completo (tanques anóxico/anaeróbico + lodos ativados).","Qméd: 1,62 L/s | Qmáx: 2,91 L/s.","Calha Parshall, decantador primário, reator aeróbio equipado com 10 difusores de bolha fina tubulares de membrana, compressor de ar IBRAN CR4 de 4 CV e bomba centrífuga de 0,75 CV para recirculação, decantador e tanque de contato.","Não possui sistema de tratamento de lodo no local (remoção via caminhão). Tanques em PRFV apresentam vulnerabilidade à exposição UV.","Manutenção rigorosa (aplicação de proteção UV), sensores de qualidade e possível ampliação de leitos de secagem.","R$ 155.993,99 (Lote de melhorias)","-22.061439","-46.581904"
"ete-bela-vista","ETE Alto da Bela Vista","ETE a desativar","Operacional (Risco Estrutural)","Sistema combinado (Reator UASB + Filtro Biológico Submerso).","Qméd: 1,54 L/s | Qmáx: 2,51 L/s.","Gradeamento em fibra, Reator UASB (44,35 m³), decantador secundário (20.000 L) e caixa cloradora.","Medição de vazão manual. Tanques expostos à radiação UV e grave risco estrutural devido à instabilidade de edificações vizinhas.","Curto prazo: medição digital e proteção UV. Longo prazo: desativação e conversão em EEEC.","-","-22.064199","-46.578768"
"ete-recanto-serra","ETE Recanto da Serra","ETE a desativar","Operacional (Subutilizada)","Tratamento primário e secundário com reator aeróbio.","Proj. Qméd 5.544 L/h (opera muito abaixo por baixa ocupação).","EEE corporando 02 bombas centrífugas (13-37 m³/h) com CLP. Reator Aeróbio (35,3 m³) com compressor de ar (4 CV) e bomba de recirculação (0,75 CV). Cloração com bomba microprocessada (0,043 L/h) e queimador de biogás (7 Nm³/h).","Vulnerabilidade solar dos componentes construídos em PRFV.","Manutenção contínua até a desativação definitiva futura (substituição por EEEC).","-","-22.058556","-46.568511"
